isbn13 ,isbn10,title,authors,categories,thumbnail,description,published_year,average_rating,numbers,ratings_count
9.78E+12,140442758,Phaedrus,Plato,Philosophy,http://books.google.com/books/content?id=fNHF-hAPJdgC&printsec=frontcover&img=1&zoom=1&source=gbs_api,"Set in the idyllic countryside outside Athens, the Phraedrusis a dialogue between the philosopher Socrates and his friend Phaedrus, inspired by their reading of a clumsy speech by the writer Lysias on the nature of love. Their conversation develops into a wide-ranging discussion on such subjects as the pursuit of beauty, the immortality of the soul and the attainment of truth, and ends with an in-depth consideration of the principles of rhetoric. Probably a work of Plato's maturity, the Phaedrusrepresents a high point in his achievement as a writer. This volume also contains two of his letters, which discuss his involvement in politics, in particular his role as adviser to Dionysius II of Syracuse, which are crucial documents for our understanding of Plato's life and career.",1973,4.12,160,216
,,,,,,,,,,
9.78E+12,140443339,The Oresteia,Aeschylus,Drama,http://books.google.com/books/content?id=NtSGKcgMIlIC&printsec=frontcover&img=1&zoom=1&source=gbs_api,"A trilogy of plays dramatizes the murder of Agamemnon by his wife, Clytaemnestra, the revenge of her son, Orestes, and his judgement by the court of Athena",1984,4.01,335,27759
9.78E+12,140443487,Lun Yü,Confucius,Philosophy,http://books.google.com/books/content?id=1e7XlNv5oX0C&printsec=frontcover&img=1&zoom=1&source=gbs_api,"Confucius' teachings, preserved by his students, consist of aphorisms and parables that illustrate his views on morality",1979,3.84,249,11565
9.78E+12,140443533,Notre-Dame de Paris,Victor Hugo;John Sturrock,Fiction,http://books.google.com/books/content?id=fYmEyx-TMlMC&printsec=frontcover&img=1&zoom=1&source=gbs_api,"Tells the story of the hunchback Quasimodeo, bell-ringer of Nortre-Dame, the archdeacon Claude Frollo, and the gypsy dancer Esmeralda who wins Quasimodo's selfless devotion.",1978,3.99,493,879
,,,,,,,,,,
9.78E+12,140443878,Terre,Émile Zola,Fiction,http://books.google.com/books/content?id=JaTP2NB6KlsC&printsec=frontcover&img=1&zoom=1&source=gbs_api,No Marketing Blurb,1980,4.08,499,1053
9.78E+12,140443940,Eugene Onegin,Aleksandr Sergeevich Pushkin;Charles Johnston,English poetry,http://books.google.com/books/content?id=c3eIQgAACAAJ&printsec=frontcover&img=1&zoom=1&source=gbs_api,"Distinguished by James E. Falen's masterful use of contemporary American English and handling of rhyme and meter, this new translation of Alexander Pushkin's verse novel ably provides English readers with the chance to experience the work of the poet Russians regard as the fountainhead of their literature. The introduction includes Falen's discussion of how his translation compares with those of his predecessors and a general analysis of the poem. Nearly one hundred notes annotate the text.""",1979,4.09,240,200
9.78E+12,140444084,Love Visions,Geoffrey Chaucer,Literary Criticism,http://books.google.com/books/content?id=renlXZJKGy4C&printsec=frontcover&img=1&zoom=1&source=gbs_api,Gathers four of Chaucer's longer poems that depict poetic dreams about the rituals and emotions of courtly love,1983,3.58,272,67
9.78E+12,140444300,Les Miserables,Victor Hugo;Norman Denny,Fiction,http://books.google.com/books/content?id=X3KZKnFd7H8C&printsec=frontcover&img=1&zoom=1&source=gbs_api,"After nineteen years in prison, Jean Valjean has difficulty adjusting to the outside world, which scorns and shuns him",1982,4.16,1232,3753
9.78E+12,140444424,Divina Commedia. English,Dante Alighieri,Poetry,http://books.google.com/books/content?id=PCLZxwEACAAJ&printsec=frontcover&img=1&zoom=1&source=gbs_api,Detailed notes accompany a modern English translation of Dante's epic poem about a spiritual pilgrim led by the ghost of Virgil through the circles of hell,1985,4.02,399,734
9.78E+12,140444432,Divina Commedia. English,Dante Alighieri,Poetry,http://books.google.com/books/content?id=wMZdyAEACAAJ&printsec=frontcover&img=1&zoom=1&source=gbs_api,"Dante relates his mystical interpretation of the heavens, and his moment of transcendent glory, as he journeys, first with Beatrice, then alone, toward the Trinity. Including an interpretive commentary, a glossary and bibliography, this translation seeks to clarify the theological themes and make Dante accessible to the English-speaking public.",1986,3.95,433,354
9.78E+12,140445145,Twilight of Idols and Anti-Christ,Friedrich Nietzsche,Philosophy,http://books.google.com/books/content?id=-ur_M2YcDYIC&printsec=frontcover&img=1&zoom=1&source=gbs_api,"'Twilight of the Idols', an attack on all the prevalent ideas of his time, offers a lightning tour of his whole philosophy. It also prepares the way for 'The Anti-Christ', a final assault on institutional Christianity. Both works show Nietzsche lashing out at self-deception, astounded at how often morality is based on vengefulness and resentment. Both reveal a profound understanding of human mean-spiritedness which still cannot destroy the underlying optimism of Nietzsche, the supreme affirmer among the great philosophers.",1990,4.16,208,6906
9.78E+12,140445226,Sketches from a Hunter's Album,Ivan Turgenev,Fiction,http://books.google.com/books/content?id=3V1ufDxyAkgC&printsec=frontcover&img=1&zoom=1&source=gbs_api,"Turgenev’s first major prose work is a series of twenty-five Sketches: the observations and anecdotes of the author during his travels through Russia satisfying his passion for hunting. His album is filled with moving insights into the lives of those he encounters – peasants and landowners, doctors and bailiffs, neglected wives and bereft mothers – each providing a glimpse of love, tragedy, courage and loss, and anticipating Turgenev’s great later works such as First Love and Fathers and Sons. His depiction of the cruelty and arrogance of the ruling classes was considered subversive and led to his arrest and confinement to his estate, but these sketches opened the minds of contemporary readers to the plight of the peasantry and were even said to have led Tsar Alexander II to abolish serfdom.",1990,3.93,403,5846
9.78E+12,140445501,Gargantua and Pantagruel,Francois Rabelais;Michael Andrew Screech,Biography & Autobiography,http://books.google.com/books/content?id=fWwtsxg7zG0C&printsec=frontcover&img=1&zoom=1&source=gbs_api,"The dazzling and exuberant moral stories of Rabelais (c. 1471-1553) expose human follies with their mischievous and often obscene humour, while intertwining the realistic with carnivalesque fantasy to make us look afresh at the world. Gargantua depicts a young giant, reduced to laughable insanity by an education at the hands of paternal ignorance, old crones and syphilitic professors, who is rescued and turned into a cultured Christian knight. And in Pantagruel and its three sequels, Rabelais parodied tall tales of chivalry and satirized the law, theology and academia to portray the bookish son of Gargantua who becomes a Renaissance Socrates, divinely guided in his wisdom, and his idiotic, self-loving companion Panurge.",2006,3.71,1041,11605
9.78E+12,140445773,Either/Or,Soren Kierkegaard,Philosophy,http://books.google.com/books/content?id=qUA-_xdRPgAC&printsec=frontcover&img=1&zoom=1&source=gbs_api,"In Either/Or, using the voices of two characters - the aesthetic young man of part one, called simply 'A', and the ethical Judge Vilhelm of the second section - Kierkegaard reflects upon the search for a meaningful existence, contemplating subjects as diverse as Mozart, drama, boredom, and, in the famous Seducer's Diary, the cynical seduction and ultimate rejection of a young, beautiful woman. A masterpiece of duality, Either/Or is a brilliant exploration of the conflict between the aesthetic and the ethical - both meditating ironically and seductively upon Epicurean pleasures, and eloquently expounding the noble virtues of a morally upstanding life.",2004,4.17,640,6148
9.78E+12,140446044,The Complete Essays,Michel Montaigne,Literary Collections,http://books.google.com/books/content?id=K_BuQw1SV_8C&printsec=frontcover&img=1&zoom=1&source=gbs_api,"In 1572 Montaigne retired to his estates in order to devote himself to leisure, reading and reflection. There he wrote his constantly expanding 'essays', inspired by the ideas he found in books from his library and his own experience. He discusses subjects as diverse as war-horses and cannibals, poetry and politics, sex and religion, love and friendship, ecstasy and experience. Above all, Montaigne studied himself to find his own inner nature and that of humanity. The Essays are among the most idiosyncratic and personal works in all literature. An insight into a wise Renaissance mind, they continue to engage, enlighten and entertain modern readers.",2004,4.23,1344,10321
9.78E+12,140446168,The Symposium,Plato;Christopher Gill,Amour - Ouvrages avant 1800,http://books.google.com/books/content?id=pdNgQgAACAAJ&printsec=frontcover&img=1&zoom=1&source=gbs_api,"In this text Plato uses a dinner party as a scene for a series of speeches by the guests. From these there emerges a complete and complex philosophy of love. The pivot of the argument is Socrates' speech in which sensuality is transcended and we move from the sensible world to the ideal world. Just as the preceding speeches are vital to the theme and scheme of progression, so to is the character sketch of Socrates by Alcibiades which rounds off the dialogue.",1999,4.03,90,169
9.78E+12,140446362,Poetics,Aristotle;Malcolm Heath,Literary Criticism,http://books.google.com/books/content?id=FECr16HHxW4C&printsec=frontcover&img=1&zoom=1&source=gbs_api,Provides a translation of Aristotle's classic study of the nature of poetry.,1996,3.82,138,11935
9.78E+12,140446427,What is Art?,Leo Tolstoy;Richard Pevear;Larissa Volokhonsky,Art,http://books.google.com/books/content?id=N7kyx0y1yYYC&printsec=frontcover&img=1&zoom=1&source=gbs_api,,1995,3.7,230,120
9.78E+12,140447202,Maxims and Reflections,Johann Goethe,Literary Collections,http://books.google.com/books/content?id=-2RWY230tW0C&printsec=frontcover&img=1&zoom=1&source=gbs_api,"Throughout his long, hectic and astonishingly varied life, Johann Wolfgang von Goethe (1749�1832) would jot down his passing thoughts on theatre programmes, visiting cards, draft manuscripts and even bills � Goethe was probably the last true �Renaissance Man�. Although employed as a Privy Councillor at the Duke of Weimar�s court, where he helped oversee major mining, road-building and irrigation projects, he also painted, directed plays, carried out research in anatomy, botany and optics � and still found time to produce masterpieces in every literary genre. His fourteen hundred Maxims and Reflections reveal some of his deepest thought on art, ethics, literature and natural science, but also his immediate reactions to books, chance encounters or his administrative work. Although variable in quality, the vast majority have a freshness and immediacy which vividly conjure up Goethe the man. They make an ideal introduction to one of the greatest of European writers.",2005,3.8,208,255
9.78E+12,140447261,The Bacchae and Other Plays,Euripides;John N. Davie;R. B. Rutherford,Drama,http://books.google.com/books/content?id=mWhUeP5STaEC&printsec=frontcover&img=1&zoom=1&source=gbs_api,"Through their sheer range, daring innovation, flawed but eloquent characters and intriguing plots, the plays of Euripides have shocked and stimulated audiences since the fifth century BC. Phoenician Women portrays the rival sons of King Oedipus and their mother�s doomed attempts at reconciliation, while Orestes shows a son ravaged with guilt after the vengeful murder of his mother. In the Bacchae, a king mistreats a newcomer to his land, little knowing that he is the god Dionysus disguised as a mortal, while in Iphigenia at Aulis, the Greek leaders take the horrific decision to sacrifice a princess to gain favour from the gods in their mission to Troy. Finally, the Rhesus depicts a world of espionage between the warring Greek and Trojan camps.",2005,4.13,360,153
9.78E+12,140447601,Democracy in America,Alexis Tocqueville;Gerald Bevan;Isaac Kramnick,History,http://books.google.com/books/content?id=PotlkxV-wF0C&printsec=frontcover&img=1&zoom=1&source=gbs_api,"A study of America's national government, egalitarian ideals, and character offers reflections on the effect of majority rule on the rights of individuals and provides insight into the rewards and responsibilities of a democratic government, in a new translation that also includes Two Weeks in the Wilderness, the author's description of the Iroquois, and Excursion to Lake Oneida. Original.",2003,4.02,992,18286
9.78E+12,140447806,The Consolation of Philosophy,Boethius;Victor Watts,Literary Criticism,http://books.google.com/books/content?id=ut44nSC0Ue0C&printsec=frontcover&img=1&zoom=1&source=gbs_api,"The Consolation of Philosophy is perhaps unique in the nature and extent of its influence on Western thinking. An eminent public figure under the Gothic emperor Theodoric, Boethius (c. A D 475-525) was also an exceptional Greek scholar and it was to the Greek philosophers that he turned when he fell from favour and was imprisoned in Pavia. Written in the period leading up to his brutal execution, it is a dialogue of alternating prose and verse between the ailing prisoner and his 'nurse' Philosophy, whose instruction on the nature of fortune and happiness, good and evil, fate and free will, restore his health and bring him to enlightenment. The clarity of Boethius's thought and his breadth of vision made The Consolation of Philosophy hugely popular throughout medieval Europe and his ideas suffused the thought of Chaucer and Dante. This translation makes it accessible to the modern reader while losing nothing of Boethius's poetic artistry and philosophical brilliance.",1999,3.97,192,7841
,,,,,,,,,,
9.78E+12,140447970,Sentimental Education,Gustave Flaubert;Robert Baldick;Geoffrey Wall,Fiction,http://books.google.com/books/content?id=b6cBs1HnSyMC&printsec=frontcover&img=1&zoom=1&source=gbs_api,"Sentimental Education begins with the hero - Frederic Moreau - leaving Paris and returning to the provinces and his mother. Part love story, part historical novel and satire it tells of how Moreau is driven by passion for an unattainable older woman. His 'sentimental education' turns out to be more of an anxious quest than a happy one, echoing Flaubert's own life experience of unrequited love. Packed with vivid detail and characterised by its historical authenticity, the book was described by Flaubert as 'the moral history of the men of my generation'.",1964,3.83,460,13081
9.78E+12,140448004,Three Tales,Gustave Flaubert;Roger Whitehouse;Geoffrey Wall,Fiction,http://books.google.com/books/content?id=XFzgaUR-Vy0C&printsec=frontcover&img=1&zoom=1&source=gbs_api,"Features short fiction by the French naturalist author that is introduced by an essay describing his life, works, and artistic abilities, as well as explanatory notes, a chronology, and suggestions for further reading.",2005,3.71,110,3050
9.78E+12,140448071,Dead Souls,Nikolay Gogol,Fiction,http://books.google.com/books/content?id=FP2wmNJclpwC&printsec=frontcover&img=1&zoom=1&source=gbs_api,"In a new translation of the comic classic of Russian literature, Chichikov, an enigmatic stranger and schemer, buys deceased serfs' names from their landlords' poll tax lists hoping to mortgage them for profit and to reinvent himself as a gentleman. Reprint.",2004,3.99,512,45903
9.78E+12,140448144,Lysistrata and Other Plays,Aristophanes;Alan H. Sommerstein,Drama,http://books.google.com/books/content?id=GGeyCcSXISoC&printsec=frontcover&img=1&zoom=1&source=gbs_api,"In Lysistrata and The Archarnians, politics as usual takes a backseat to the machinations of, respectively, a group of women and a single peasant, while The clouds takes satiric aim at the philosophers of Athens.",2002,3.96,241,3723
9.78E+12,140448152,Early Greek Philosophy,Jonathan Barnes,Philosophy,http://books.google.com/books/content?id=ooq9SnHIdxIC&printsec=frontcover&img=1&zoom=1&source=gbs_api,"Examines early Greek philosophy, which relied on reasoning and forged the first scientific vocabulary, and includes discussion of such topics as Democritus' atomic theory of matter and Pythagorean insights into mathematics.",2001,4.09,336,2022
9.78E+12,140448926,The Black Tulip,Alexandre Dumas Pere,Fiction,http://books.google.com/books/content?id=GNHcP8V-YQ0C&printsec=frontcover&img=1&zoom=1&source=gbs_api,"Set at the height of the ""tulipomania"" that gripped Holland in 17th century, this is the story of Cornelius van Baerle, a humble grower whose sole desire is to grow the perfect specimen of the tulip negra. When his godfather is murdered, Cornelius finds himself caught up in the deadly politics of the time, imprisoned and facing a death sentence. His jailor's daughter Rosa, holds both the key to his survival and his chance to produce the ultimate tulip.",2003,3.8,246,9710
9.78E+12,140448942,City of God,Augustine;Henry Scowcroft Bettenson;Gillian Rosemary Evans,History,http://books.google.com/books/content?id=SaznVNuqrAAC&printsec=frontcover&img=1&zoom=1&source=gbs_api,"One of the great cornerstones in the history of Christian philosophy, The City of God provides an insightful interpretation of the development of modern Western society and the origin of most Western thought. Contrasting earthly and heavenly cities--representing the omnipresent struggle between good and evil--Augustine explores human history in its relation to all eternity. In Thomas Merton's words, ""The City of God is the autobiography of the Church written by the most Catholic of her great saints."" This Modern Library Paperback Classics edition is a complete and unabridged version of the Marcus Dods translation.",2003,3.92,1186,8508
9.78E+12,140449086,The Histories,Herodotus,History,http://books.google.com/books/content?id=x-gAoTSj8qkC&printsec=frontcover&img=1&zoom=1&source=gbs_api,"One of the masterpieces of classical literature, the Histories describes how a small and quarrelsome band of Greek city states united to repel the might of the Persian empire. But while this epic struggle forms the core of his work, Herodotus' natural curiosity frequently gives rise to colourful digressions - a description of the natural wonders of Egypt; an account of European lake-dwellers; and far-fetched accounts of dog-headed men and gold-digging ants. With its kaleidoscopic blend of fact and legend, the Histories offers a compelling Greek view of the world of the fifth century BC.",2003,3.98,716,32923
9.78E+12,140449094,Don Quixote,Miguel de Cervantes Saavedra,Fiction,http://books.google.com/books/content?id=kHq_PcQhhyUC&printsec=frontcover&img=1&zoom=1&source=gbs_api,"This text is a revised edition of Cervantes' classic tale. Don Quixote has become so entranced by reading romances of chivalry that he determines to become a knight errant and pursue bold adventures, accompanied by his squire, the cunning Sancho Panza.",2003,3.87,1056,311
9.78E+12,140449124,Madame Bovary,Gustave Flaubert;Geoffrey Wall,Fiction,http://books.google.com/books/content?id=2XIoODQ-JSsC&printsec=frontcover&img=1&zoom=1&source=gbs_api,"An unhappily married woman, Emma Bovary's unfulfilled dreams of romantic love and desperation to escape the ordinary boredom of her life lead her to a series of desperate acts, including adultery, in a classic novel set against the backdrop of nineteenth-",2003,3.66,327,3484
9.78E+12,140449140,The Republic,Plato;Sir Henry Desmond Pritchard Lee,Philosophy,http://books.google.com/books/content?id=R9PawAEACAAJ&printsec=frontcover&img=1&zoom=1&source=gbs_api,"A model for the ideal state includes discussion of the nature and application of justice, the role of the philosopher in society, the goals of education, and the effects of art upon character.",2003,3.93,416,127393
9.78E+12,140449175,Anna Karenina,Leo Tolstoy;Richard Pevear,Fiction,http://books.google.com/books/content?id=NjBz-8TLnTEC&printsec=frontcover&img=1&zoom=1&source=gbs_api,The Award-Winning New Translation Of The Great Russian Novel.,2002,4.04,837,2835
9.78E+12,140449213,The Twelve Caesars,Suetonius,Fiction,http://books.google.com/books/content?id=S9ME1LYHuFMC&printsec=frontcover&img=1&zoom=1&source=gbs_api,"Presents biographies of twelve Roman rulers from Julius Caesar to Domitian, providing details of their private and public lives.",2002,4.05,363,12365
,,,,,,,,,,
9.78E+12,140449248,The Brothers Karamazov,Fyodor Dostoyevsky,Fiction,http://books.google.com/books/content?id=HOf-64Go9cgC&printsec=frontcover&img=1&zoom=1&source=gbs_api,Translated with an Introduction by David McDuff.,2003,4.32,1013,1497
9.78E+12,140449280,The Last Days of Socrates,Plato;Hugh Tredennick,Fiction,http://books.google.com/books/content?id=vwj_1haGR9wC&printsec=frontcover&img=1&zoom=1&source=gbs_api,"Chronicling the life and death of the father of western philosophy, and charting his influence on the most influential ancient Greek philosophers, Plato's The Last Days of Socrates is translated from the Greek by Hugh Tredennick, revised with an introduction and notes by Harold Tarrant in Penguin Classics. The trial and condemnation of Socrates on charges of heresy and corrupting young minds is a defining moment in the history of Classical Athens. In tracing these events through four dialogues, Plato also developed his own philosophy, based on Socrates' manifesto for a life guided by self-responsibility. Euthyphro finds Socrates outside the court-house, debating the nature of piety, while the Apology is his robust rebuttal of the charges of impiety and a defence of the philosopher's life. In the Crito, while awaiting execution in prison, Socrates counters the arguments of friends urging him to escape. Finally, in the Phaedo, he is shown calmly confident in the face of death, skilfully arguing the case for the immortality of the soul. Hugh Tredennick's landmark 1954 translation has been revised by Harold Tarrant, reflecting changes in Platonic studies, with an introduction and expanded introductions to each of the four dialogues. Plato (c.427-347 BC) stands with Socrates and Aristotle as one of the shapers of the whole intellectual tradition of the West. He founded the Academy in Athens, the first permanent institution devoted to philosophical research and teaching, and the prototype of all Western universities. If you enjoyed The Last Days of Socrates, you might like Plato's The Symposium, also available in Penguin Classics.",2003,4.07,256,1571
9.78E+12,140449329,The Aeneid,Virgil,Literary Criticism,http://books.google.com/books/content?id=3GwIVFFlnDUC&printsec=frontcover&img=1&zoom=1&source=gbs_api,"Virgil's Aeneid, inspired by Homer and inspiration for Dante and Milton, is an immortal poem at the heart of Western life and culture. Virgil took as his hero Aeneas, legendary survivor of the fall of Troy and father of the Roman race, and in telling a story of dispossession and defeat, love and war, he portrayed human life in all its nobility and suffering.",2003,3.83,290,937
9.78E+12,140449493,The Nicomachean Ethics,Aristotle,Philosophy,http://books.google.com/books/content?id=iBoqmEvavawC&printsec=frontcover&img=1&zoom=1&source=gbs_api,"Previously published as Ethics, Aristotle's The Nicomachean Ethics addresses the question of how to live well, and originates the concept of cultivating a virtuous character as the basis of his ethical system. This Penguin Classics edition is translated from the Greek by J.A.K. Thomson with revisions and notes by Hugh Tredennick, and an introduction and bibliography by Jonathan Barnes. 'One swallow does not make a summer; neither does one day. Similarly neither can one day, or a brief space of time, make a man blessed and happy' In The Nicomachean Ethics, Aristotle sets out to examine the nature of happiness. He argues that happiness consists in 'activity of the soul in accordance with virtue', for example with moral virtues, such as courage, generosity and justice, and intellectual virtues, such as knowledge, wisdom and insight. The Ethics also discusses the nature of practical reasoning, the value and the objects of pleasure, the different forms of friendship, and the relationship between individual virtue, society and the State. Aristotle's work has had a profound and lasting influence on all subsequent Western thought about ethical matters. Aristotle (384-22 BC) studied at the Academy of Plato for 20 years and then established his own school and research institute, 'The Lyceum'. His writings, which were of extraordinary range, profoundly affected the whole course of ancient and medieval philosophy and are still eagerly studied and debated by philosophers today. If you enjoyed The Nicomachean Ethics, you might like Plato's The Symposium, also available in Penguin Classics.",2004,3.93,329,22199
9.78E+12,140449515,The Birds and Other Plays,Aristophanes;David Barrett;Alan H. Sommerstein,Drama,http://books.google.com/books/content?id=i15nevzKzvoC&printsec=frontcover&img=1&zoom=1&source=gbs_api,"Collects five comedies from Aristophanes, including ""The Birds,"" in which two Athenians join the birds to build a utopian city.",1978,4.13,336,1241
