isbn13 ,isbn10,title,authors,categories,thumbnail,description,published_year,average_rating,numbers,ratings_count
9.78E+12,60747471,This Rough Magic,Mary Stewart,Fiction,http://books.google.com/books/content?id=BjFn9MD8n10C&printsec=frontcover&img=1&zoom=1&source=gbs_api,"A fledgling actress vacationing in Corfu, Lucy Waring witnesses the murder of one of England's theater luminaries and becomes embroiled in a dangerous offstage drama. Reprint.",2004,4.05,373,4966
9.78E+12,60751649,The Mediator #5: Haunted,Meg Cabot,Juvenile Fiction,http://books.google.com/books/content?id=3EDbEHca_k8C&printsec=frontcover&img=1&zoom=1&edge=curl&source=gbs_api,"Suze is used to trouble, but this time she's in deep: Ghostly Jesse has her heart, but Paul Slater, a real flesh—and—blood guy, is warm for her form. And mediator Paul knows how to send Jesse to the Great Beyond. For good. Paul claims he won't do anything to Jesse as long as Suze will go out with him. Fearing she'll lose Jesse forever, Suze agrees. But even if Suze can get Jesse to admit his true feelings for her, what kind of future can she have with a guy who's already dead?",2004,4.15,263,31501
9.78E+12,60753102,Beauty,Robin McKinley,Juvenile Fiction,http://books.google.com/books/content?id=EaWWnkiShpIC&printsec=frontcover&img=1&zoom=1&source=gbs_api,"A strange imprisonment Beauty has never liked her nickname. She is thin and awkward; it is her two sisters who are the beautiful ones. But what she lacks in looks, she can perhaps make up for in courage. When her father comes home with the tale of an enchanted castle in the forest and the terrible promise he had to make to the Beast who lives there, Beauty knows she must go to the castle, a prisoner of her own free will. Her father protests that he will not let her go, but she answers, ""Cannot a Beast be tamed?"" Robin McKinley's beloved telling illuminates the unusual love story of a most unlikely couple: Beauty and the Beast.",2005,4.05,325,3203
9.78E+12,60753633,Mating in Captivity,Esther Perel,Psychology,http://books.google.com/books/content?id=-HIhMOQanIEC&printsec=frontcover&img=1&zoom=1&source=gbs_api,"A guide for loving couples who are looking to renew sexual passion in their lives explains how societal taboos and ideals about domestic equality have compromised the healthy expression of eroticism in today's relationships, in a resource that explains how to overcome personal constraints for greater intimacy. 40,000 first printing.",2006,4.13,272,7699
9.78E+12,60754001,Forgotten New York,Kevin Walsh,Travel,http://books.google.com/books/content?id=77aiRf018Y0C&printsec=frontcover&img=1&zoom=1&source=gbs_api,"Forgotten New York is your passport to more than 300 years of history, architecture, and memories hidden in plain sight. Houses dating to the first Dutch settlers on Staten Island; yellow brick roads in Brooklyn; clocks embedded in the sidewalk in Manhattan; bishop's crook lampposts in Queens; and a white elephant in the Bronx—this is New York and this is your guide to seeing it all. Forgotten New York covers all five boroughs with easy-to-use maps and suggested routes to hundreds of out-of-the way places, antiquated monuments, streets to nowhere, and buildings from a time lost. Forgotten New York features: Quiet Places Truly Forgotten History Happened Here What Is This Thing? Forgotten People And so much more",2006,4.18,384,198
9.78E+12,60758767,The Dead Beat,Marilyn Johnson,Social Science,http://books.google.com/books/content?id=b03jlgEACAAJ&printsec=frontcover&img=1&zoom=1&source=gbs_api,"Marilyn Johnson was enthralled by the remarkable lives that were marching out of this world—so she sought out the best obits in the English language and the people who spent their lives writing about the dead. She surveyed the darkest corners of Internet chat rooms, and made a pilgrimage to London to savor the most caustic and literate obits of all. Now she leads us on a compelling journey into the cult and culture behind the obituary page and the unusual lives we don't quite appreciate until they're gone.",2007,3.41,272,1106
9.78E+12,60760257,Charms for the Easy Life,Kaye Gibbons,Fiction,http://books.google.com/books/content?id=TE2mBDsQyvkC&printsec=frontcover&img=1&zoom=1&source=gbs_api,"A family without men, the Birches live gloriously offbeat lives in the lush, green backwoods of North Carolina. Radiant, headstrong Sophia and her shy, brilliant daughter, Margaret, possess powerful charms to ward off loneliness, despair, and the human misery that often beats a path to their door. And they are protected by the eccentric wisdom and muscular love of the remarkable matriarch Charlie Kate, a solid, uncompromising, self-taught healer who treats everything from boils to broken bones to broken hearts. Sophia, Margaret, and Charlie Kate find strength in a time when women almost always depended on men, and their bond deepens as each one experiences love and loss during World War II. Charms for the Easy Life is a passionate, luminous, and exhilarating story about embracing what life has to offer ... even if it means finding it in unconventional ways. This P.S. edition features an extra 16 pages of insights into the book, including author interviews, recommended reading, and more.",2005,4.02,272,10983
9.78E+12,60760443,The Reading Group,Elizabeth Noble,Fiction,http://books.google.com/books/content?id=IagWjwEACAAJ&printsec=frontcover&img=1&zoom=1&source=gbs_api,"The Reading Group follows the trials and tribulations of a group of women who meet regularly to read and discuss books.Over the course of a year, each of these women become intertwined, both in the books they read and within each other's lives. Inspired by a shared desire for conversation, a good book and a glass of wine-Clare, Harriet, Nicole, Polly, and Susan undergo startling revelations and transformations despite their differences in background, age and respective dilemmas. What starts as a reading group gradually evolves into a forum where the women may express their views through the books they read and grow to become increasingly more open as the bonds of friendship cement. In The Reading Group, Noble reveals the many complicated paths in life we all face as well as the power and importance of friendship. This P.S. edition features an extra 16 pages of insights into the book, including author interviews, recommended reading, and more.",2005,3.34,429,6408
9.78E+12,60760826,A Couple of April Fools,Gregory Maguire,Juvenile Fiction,http://books.google.com/books/content?id=qW4cvgAACAAJ&printsec=frontcover&img=1&zoom=1&source=gbs_api,"At a Vermont elementary school, April Fools' Day takes on a sinister tone when a teacher goes missing and several suspects emerge, among them the teacher's fiance and a missing mutant chick.",2005,3.5,240,3
9.78E+12,60761539,What Christians Believe,C. S. Lewis,Religion,http://books.google.com/books/content?id=81T46KixNg8C&printsec=frontcover&img=1&zoom=1&source=gbs_api,"The Essentials Explained Master storyteller and essayist C. S. Lewis here tackles the central questions of the Christian faith: Who was Jesus? What did he accomplish? What does it mean for me? In these classic essays, which began as talks on the BBC during World War II, Lewis creatively and simply explains the basic tenets of Christianity. Taken from the core section of Mere Christianity, the selection in this gift edition provides an accessible way for more people to discover these timeless truths. For those looking to remind themselves of the things they hold true, or those looking for a snapshot of Christianity, this book is a wonderful introduction to the faith.",2005,4.2,98,517
9.78E+12,60763728,Psyche in a Dress,Francesca Lia Block,Juvenile Fiction,http://books.google.com/books/content?id=NYE3GwAACAAJ&printsec=frontcover&img=1&zoom=1&source=gbs_api,"But this is what I could not give up: I could not give up myself Psyche has known Love—scented with jasmine and tasting of fresh oranges. Yet he is fleeting and fragile, lost to her too quickly. Punished by self-doubt, Psyche yearns to be transformed, like the beautiful and brutal figures in the myths her lover once spoke of. Attempting to uncover beauty in the darkness, she is challenged, tested, and changed by the gods and demons who tempt her. Her faith must be found again, for if she is to love, she must never look back.",2006,3.84,116,2414
9.78E+12,60765313,YOU: The Owner's Manual,Michael F Roizen;Mehmet C Oz,Health & Fitness,http://books.google.com/books/content?id=WMtZ29Fjx2MC&printsec=frontcover&img=1&zoom=1&source=gbs_api,"Outlines steps to achieving overall physical health, addressing each area of the body in a series of chapters designed to challenge popular myths while informing readers on a range of dietary, exercise, and therapeutic concerns.",2005,3.82,417,3099
9.78E+12,60765453,The Chronicles of Narnia Movie Tie-in Edition (adult),C. S. Lewis,Fiction,http://books.google.com/books/content?id=4qVxvQEACAAJ&printsec=frontcover&img=1&zoom=1&source=gbs_api,"When Digory and Polly try to return the wicked witch Jadis to her own world, the magic gets mixed up and they all land in Narnia where they witness Aslan blessing the animals with human speech.",2005,4.26,766,1099
9.78E+12,60765488,"The Lion, the Witch and the Wardrobe Movie Tie-in Edition (rack)",C. S. Lewis,Juvenile Fiction,http://books.google.com/books/content?id=u95ZvAEACAAJ&printsec=frontcover&img=1&zoom=1&source=gbs_api,"They open a door and enter a world Narnia ... a land frozen in eternal winter ... a country waiting to be set free. Four adventurers step through a wardrobe door and into the land of Narnia -- a land enslaved by the power of the White Witch. But when almost all hope is lost, the return of the Great Lion, Aslan, signals a great change ... and a great sacrifice.",2005,4.21,189,615
9.78E+12,60766743,"The Nightmare Room, Books 1-2-3: The Nightmare Begins!",R.L. Stine,Juvenile Fiction,http://books.google.com/books/content?id=R_LRInz7X1QC&printsec=frontcover&img=1&zoom=1&source=gbs_api,Presents three stories of teenagers beset by horrible curses and strange powers.,2005,3.89,432,92
9.78E+12,60773758,A Quick Bite,Lynsay Sands,Fiction,http://books.google.com/books/content?id=xIJ5TMzPsHYC&printsec=frontcover&img=1&zoom=1&source=gbs_api,"That hot guy tied to Lissianna Argeneau's bed? He's not dessert—he's the main course! Lissianna has been spending her centuries pining for Mr. Right, not just a quick snack, and this sexy guy she finds in her bed looks like he might be a candidate. But there's another, more pressing issue: her tendency to faint at the sight of blood . . . an especially annoying quirk for a vampire. Of course it doesn't hurt that this man has a delicious-looking neck. What kind of cold-blooded vampire woman could resist a bite of that? Dr. Gregory Hewitt recovers from the shock of waking up in a stranger's bedroom pretty quickly—once he sees a gorgeous woman about to treat him to a wild night of passion. But is it possible for the good doctor to find true love with a vampire vixen, or will he be just a good meal? That's a question Dr. Greg might be willing to sink his teeth into . . . if he can just get Lissianna to bite.",2005,3.91,360,34478
9.78E+12,60775858,Goodnight Moon 60th Anniversary Edition,Margaret Wise Brown,Juvenile Fiction,http://books.google.com/books/content?id=lLYOrikgtJoC&printsec=frontcover&img=1&zoom=1&source=gbs_api,"In a great green room, tucked away in bed, is a little bunny. ""Goodnight room, goodnight moon."" And to all the familiar things in the softly lit room -- to the picture of the three little bears sitting on chairs, to the clocks and his socks, to themittens and the kittens, toeverything one by one -- the little bunny says goodnight. In this classic of children's literature, beloved by generations of readers and listeners, the quiet poetry of the words and the gentle, lulling illustrations combine to make a perfect book for the end of the day.",2005,4.27,32,264013
9.78E+12,60776099,Brave New World and Brave New World Revisited,Aldous Huxley,Fiction,http://books.google.com/books/content?id=3h9eNAyQWzAC&printsec=frontcover&img=1&zoom=1&source=gbs_api,"The astonishing novel Brave New World, originally published in 1932, presents Aldous Huxley's vision of the future -- of a world utterly transformed. Through the most efficient scientific and psychological engineering, people are genetically designed to be passive and therefore consistently useful to the ruling class. This powerful work of speculative fiction sheds a blazing critical light on the present and is considered to be Huxley's most enduring masterpiece. Following Brave New World is the nonfiction work Brave New World Revisited, first published in 1958. It is a fascinating work in which Huxley uses his tremendous knowledge of human relations to compare the modern-day world with the prophetic fantasy envisioned in Brave New World, including threats to humanity, such as overpopulation, propaganda, and chemical persuasion.",2005,4.16,340,123044
9.78E+12,60777109,The Final Solution,Michael Chabon,Fiction,http://books.google.com/books/content?id=xXtptpBIYP8C&printsec=frontcover&img=1&zoom=1&source=gbs_api,"Retired to the English countryside, an eighty-nine-year-old man, rumored to be a once-famous detective, is more concerned with his beekeeping than with his fellow man. Into his life wanders Linus Steinman, nine years old and mute, who has escaped from Nazi Germany with his sole companion: an African gray parrot. What is the meaning of the mysterious strings of German numbers the bird spews out -- a top-secret SS code? The keys to a series of Swiss bank accounts? Or do they hold a significance both more prosaic and far more sinister? Though the solution may be beyond even the reach of the once-famous sleuth, the true story of the boy and his parrot is subtly revealed in a wrenching resolution.",2005,3.31,131,13455
9.78E+12,60777338,The Cat's Pajamas,Ray Bradbury,Fiction,http://books.google.com/books/content?id=Xb6MUmQrUMAC&printsec=frontcover&img=1&zoom=1&source=gbs_api,"From the winner of the National Book Foundations' 2000 Medal for Distinguished Contribution to American Letters comes a ""sweet, funny . . . thought–provoking"" (Milwaukee Journal Sentinel) collection of short stories. As in his most recent major fiction collections, One More for the Road (1999) and Driving Blind (1997), Ray Bradbury has once again pulled together a stellar group of stories sure to delight readers of all ages. In The Cat's Pyjamas we are treated to a treasure trove of Bradbury gems old and new –– eerie and strange, nostalgic and bittersweet, searching and speculative –– all but two of which have never been published before. The Cat's Pyjamas is a joyous celebration of the lifelong work of a literary legend.",2005,3.73,234,1316
9.78E+12,60778016,Holy Skirts,Rene Steinke,Fiction,http://books.google.com/books/content?id=BjP7lwEACAAJ&printsec=frontcover&img=1&zoom=1&source=gbs_api,"No one in 1917 New York had ever encountered a woman like the Bar-oness Elsa von Freytag-Loringhoven -- poet, artist, proto-punk rocker, sexual libertine, fashion avatar, and unrepentant troublemaker. When she wasn't stalking the streets of Greenwich Village wearing a brassiere made from tomato cans, she was enthusiastically declaiming her poems to sailors in beer halls or posing nude for Man Ray or Marcel Duchamp. In an era of brutal war, technological innovation, and cataclysmic change, the Baroness had resolved to create her own destiny -- taking the center of the Dadaist circle, breaking every bond of female propriety . . . and transforming herself into a living, breathing work of art.",2005,3.61,384,322
9.78E+12,60782137,Time For Kids: Butterflies!,Editors of TIME For Kids,Juvenile Nonfiction,http://books.google.com/books/content?id=OdZxnI53jj4C&printsec=frontcover&img=1&zoom=1&source=gbs_api,"Butterflies There are 20,000 different kinds of butterflies in the world. Many have brightly colored wings. But butterflies don't start life as beauties. Every butterfly begins as a tiny egg that hatches into a caterpillar. Then an amazing change takes place. The caterpillar turns into a fluttering butterfly!",2006,4,32,20
9.78E+12,60786736,A False Mirror,Charles Todd,Fiction,http://books.google.com/books/content?id=MMG3b9fo-hYC&printsec=frontcover&img=1&zoom=1&source=gbs_api,"Summoned to a small harbor town by a former trenchmate falsely accused of assaulting an ex-lover's husband, Scotland Yard inspector Ian Rutledge is reminded of an affair from his own past and investigates a bizarre coincidence.",2007,4.02,384,2354
9.78E+12,60787031,Cracks in My Foundation,Marian Keyes,Fiction,http://books.google.com/books/content?id=cC8-lwEACAAJ&printsec=frontcover&img=1&zoom=1&source=gbs_api,"Go further under the covers and stay in bed a little longer with Marian Keyes in this winning follow-up to her smash essay collection, Under the Duvet. Written in the witty, forthright style that has earned her legions of devoted readers, Cracks in My Foundation offers an even deeper and more candid look into this beloved author's mind and heart, exploring such universal themes as friends and family, home, glamour and beauty, children, travel, and more. Marian's hilarious and thoughtful take on life makes her readers feel they are reading a friend, not just an author. Marian continues to entertain with her reports from the trenches, and throws in some original short fiction as well. Whether it's visiting Siberia, breaking it off with an old hairdresser, shopping (of course!), turning forty, living with her beloved husband, Himself (a man beyond description), or musing on the F word (feminism), Marian shares the joys, passions, and sorrows of her world and helps us feel good about our own. So grab a latte and a pillow and get ready to laugh your slippers off!",2005,3.81,368,1569
9.78E+12,60788194,A Fistful of Charms,Kim Harrison,Fiction,http://books.google.com/books/content?id=o_jxvQEACAAJ&printsec=frontcover&img=1&zoom=1&source=gbs_api,"The evil night things that prowl Cincinnati despise witch and bounty hunter Rachel Morgan. Her new reputation for the dark arts is turning human and undead heads alike with the intent to possess, bed, and kill her -- not necessarily in that order. Now a mortal lover who abandoned Rachel has returned, haunted by his secret past. And there are those who covet what Nick possesses -- savage beasts willing to destroy the Hollows and everyone in it if necessary. Forced to keep a low profile or eternally suffer the wrath of a vengeful demon, Rachel must nevertheless act quickly. For the pack is gathering for the first time in millennia to ravage and to rule. And suddenly more than Rachel's soul is at stake.",2006,4.28,510,46881
9.78E+12,60788380,For a Few Demons More,Kim Harrison,Fiction,http://books.google.com/books/content?id=ya3Nq-_dqG8C&printsec=frontcover&img=1&zoom=1&source=gbs_api,"When a serial murderer begins killing off members of Hollows society, Rachel Morgan finds herself swept up in a brutal Inderland gang war, a situation that is complicated by her demonic nemesis, and the release of a vampire master.",2007,4.33,456,47314
9.78E+12,60790598,Mysteries of Pittsburgh,Michael Chabon,Fiction,http://books.google.com/books/content?id=wh8B41h8bqQC&printsec=frontcover&img=1&zoom=1&source=gbs_api,"By the Pulitzer Prize-winning author of The Amazing Adventures of Kavalier & Clay This P.S. edition features an extra 16 pages of insights into the book, including author interviews, recommended reading, and more.",2005,3.64,320,21338
9.78E+12,60792175,Everything Is Illuminated tie-in,Jonathan Safran Foer,Fiction,http://books.google.com/books/content?id=tsO2vgEACAAJ&printsec=frontcover&img=1&zoom=1&source=gbs_api,"With only a yellowing photograph in hand, a young man -- also named Jonathan Safran Foer -- sets out to find the woman who may or may not have saved his grandfather from the Nazis. Accompanied by an old man haunted by memories of the war; an amorous dog named Sammy Davis, Junior, Junior; and the unforgettable Alex, a young Ukrainian translator who speaks in a sublimely butchered English, Jonathan is led on a quixotic journey over a devastated landscape and into an unexpected past. By turns comic and tragic, but always passionate, wildly inventive, and touched with an indelible humanity, this debut novel is a powerful, deeply felt story of searching: for the past, family, and truth.",2005,3.9,276,1754
9.78E+12,60792787,Flight of the Nighthawks,Raymond E. Feist,Fiction,http://books.google.com/books/content?id=cMRnRK9KE9wC&printsec=frontcover&img=1&zoom=1&source=gbs_api,"A new evil threatens Midkemia, its web stretching from the deepest criminal underworld all the way up to the highest seats of power in ancient Kesh. And the Conclave of Shadows, charged unexpectedly with the training of two apprentices, must also best powerful agents of the darkest magic . . . for the fate of two worlds lies in the balance. The New York Times bestselling author and master of fantasy Raymond E. Feist returns to his signature world of Midkemia in this first book in a gripping new trilogy that ushers in the third, and most dramatic, Riftwar yet: the Darkwar. In the middle of the night on Sorcerer's Isle, the powerful sorcerer Pug is awakened from a nightmare that portends destruction for all of Midkemia. Disturbed by the dream, Pug calls for a convening of the Conclave of Shadows. Though Pug does not yet know it, his son Magnus has discovered the cause of Pug's prophetic dream: a beacon has been unleashed, directing a vast army of alien invaders to Midkemia, an army so formidable that even the might of the Tsurani Empire might fall before its fury. Meanwhile, in far Stardock town, two boys are coming of age. But on the dusty path that leads them from home they are thrust by fate into a life undreamed of, becoming enmeshed in intrigue, murder, and treason. Though untrained and unready, they are called upon by the mysterious Conclave to travel deep into the heart of the Empire of Great Kesh, to confront a plot so dark and twisted it will implicate even the highest-ranking nobles of the Empire, even members of the royal family itself. And behind this plot they discover the ancient Brotherhood of Death, the clan of assassins known as the Nighthawks. And Pug will find himself once again facing his old nemesis, the evil wizard formerly known as Sidi, now Leso Varen, in a confrontation with everything at stake: his honor, his life, and the future of Midkemia.",2006,3.95,368,9378
9.78E+12,60792809,Into a Dark Realm,Raymond E. Feist,Fiction,http://books.google.com/books/content?id=pSzYD55i6nAC&printsec=frontcover&img=1&zoom=1&source=gbs_api,"Having successfully prevented a civil war within the Empire of Great Kesh, Pug and his allies in the Conclave of Shadows search for the mad sorcerer Leso Varen in the hopes of destroying the Guild of Assassins, an effort that is challenged by the sorcerer's powerful protectors and a planned invasion by the Dasati. By the author of Flight of the Nighthawks. 75,000 first printing.",2007,4,319,8974
9.78E+12,60793198,The 3-Hour Diet (TM) On the Go (Collins Gem),Jorge Cruise,Health & Fitness,http://books.google.com/books/content?id=xaefjgEACAAJ&printsec=frontcover&img=1&zoom=1&source=gbs_api,"More Than 600 New Options! Imagine eating your favorite foods every 3 hours to finally get the results you've been searching for. NO calorie-counting, NO carb deprivation, and NO skipping sweets. Based on the revolutionary principles of Time-Based Nutrition™, this pocket guidebook will give you the slimming secrets you need to enjoy fast food, restaurant meals, gas station gourmet, and much more! Visit www.3hourdiet.net for your free personalized weight-loss profile.",2005,3.08,192,30
9.78E+12,60815523,The Best American Crime Writing 2006,Mark Bowden;Otto Penzler;Thomas H. Cook,True Crime,http://books.google.com/books/content?id=Ec5HlwEACAAJ&printsec=frontcover&img=1&zoom=1&source=gbs_api,"A sterling collection of the year's most shocking, compelling, and gripping writing about real-life crime, the 2006 edition of The Best American Crime Writing offers fascinating vicarious journeys into a world of felons and their felonious acts. This thrilling compendium includes: Jeffrey Toobin's eye-opening exposé in The New Yorker about a famous prosecutor who may have put the wrong man on death row Skip Hollandsworth's amazing but true tale of an old cowboy bank robber who turned out to be a ""classic good-hearted Texas woman"" Jimmy Breslin's stellar piece about the end of the Mob as we know it",2006,3.99,352,200
9.78E+12,60815914,Last of the Wilds,Trudi Canavan,Fiction,http://books.google.com/books/content?id=lkQ-lwEACAAJ&printsec=frontcover&img=1&zoom=1&source=gbs_api,"After pitched battle, The White—the avatars of the Five Gods—have briefly turned back the vicious invaders. And now, the priestess Auraya is sent on an urgent mission to reconcile with the powerful, outcast Dreamweavers, for their magical healing abilities may be the key to saving the land. But as a deadly plague devastates their allies and old adversaries resurface, a dreadful surprise may ruin the chance for peace. For Auraya's terrible discovery will force her into a desperate choice—one whose consequences will change the world forever.",2006,4.03,576,9725
