isbn13 ,isbn10,title,authors,categories,thumbnail,description,published_year,average_rating,numbers,ratings_count
9.78E+12,2005883,Gilead,Marilynne Robinson,Fiction,http://books.google.com/books/content?id=KQZCPgAACAAJ&printsec=frontcover&img=1&zoom=1&source=gbs_api,"A NOVEL THAT READERS and critics have been eagerly anticipating for over a decade, Gilead is an astonishingly imagined story of remarkable lives. John Ames is a preacher, the son of a preacher and the grandson (both maternal and paternal) of preachers. It’s 1956 in Gilead, Iowa, towards the end of the Reverend Ames’s life, and he is absorbed in recording his family’s story, a legacy for the young son he will never see grow up. Haunted by his grandfather’s presence, John tells of the rift between his grandfather and his father: the elder, an angry visionary who fought for the abolitionist cause, and his son, an ardent pacifist. He is troubled, too, by his prodigal namesake, Jack (John Ames) Boughton, his best friend’s lost son who returns to Gilead searching for forgiveness and redemption. Told in John Ames’s joyous, rambling voice that finds beauty, humour and truth in the smallest of life’s details, Gilead is a song of celebration and acceptance of the best and the worst the world has to offer. At its heart is a tale of the sacred bonds between fathers and sons, pitch-perfect in style and story, set to dazzle critics and readers alike.",2004,3.85,247,361
9.78E+12,2261987,Spider's Web,Charles Osborne;Agatha Christie,Detective and mystery stories,http://books.google.com/books/content?id=gA5GPgAACAAJ&printsec=frontcover&img=1&zoom=1&source=gbs_api,"A new 'Christie for Christmas' -- a full-length novel adapted from her acclaimed play by Charles Osborne Following BLACK COFFEE and THE UNEXPECTED GUEST comes the final Agatha Christie play novelisation, bringing her superb storytelling to a new legion of fans. Clarissa, the wife of a Foreign Office diplomat, is given to daydreaming. 'Supposing I were to come down one morning and find a dead body in the library, what should I do?' she muses. Clarissa has her chance to find out when she discovers a body in the drawing-room of her house in Kent. Desperate to dispose of the body before her husband comes home with an important foreign politician, Clarissa persuades her three house guests to become accessories and accomplices. It seems that the murdered man was not unknown to certain members of the house party (but which ones?), and the search begins for the murderer and the motive, while at the same time trying to persuade a police inspector that there has been no murder at all... SPIDER'S WEB was written in 1954 specifically for Margaret Lockwood and opened first at the Theatre Royal Nottingham before moving to the Savoy Theatre in London on 14 December 1954. With THE MOUSETRAP and WI",2000,3.83,241,5164
9.78E+12,6163831,The One Tree,Stephen R. Donaldson,American fiction,http://books.google.com/books/content?id=OmQawwEACAAJ&printsec=frontcover&img=1&zoom=1&source=gbs_api,Volume Two of Stephen Donaldson's acclaimed second trilogy featuing the compelling anti-hero Thomas Covenant.,1982,3.97,479,172
9.78E+12,6178731,Rage of angels,Sidney Sheldon,Fiction,http://books.google.com/books/content?id=FKo2TgANz74C&printsec=frontcover&img=1&zoom=1&source=gbs_api,"A memorable, mesmerizing heroine Jennifer -- brilliant, beautiful, an attorney on the way up until the Mafia's schemes win her the hatred of an implacable enemy -- and a love more destructive than hate. A dangerous, dramatic world The Dark Arena of organized crime and flashbulb lit courtrooms where ambitious prosecutors begin their climb to political power.",1993,3.93,512,29532
9.78E+12,6280897,The Four Loves,Clive Staples Lewis,Christian life,http://books.google.com/books/content?id=XhQ5XsFcpGIC&printsec=frontcover&img=1&zoom=1&source=gbs_api,"Lewis' work on the nature of love divides love into four categories; Affection, Friendship, Eros and Charity. The first three come naturally to humanity. Charity, however, the Gift-love of God, is divine, and without this supernatural love, the natural loves become distorted and even dangerous.",2002,4.15,170,33684
9.78E+12,6280935,The Problem of Pain,Clive Staples Lewis,Christian life,http://books.google.com/books/content?id=Kk-uVe5QK-gC&printsec=frontcover&img=1&zoom=1&source=gbs_api,"""In The Problem of Pain, C.S. Lewis, one of the most renowned Christian authors and thinkers, examines a universally applicable question within the human condition: If God is good and all-powerful, why does he allow his creatures to suffer pain? With his signature wealth of compassion and insight, C.S. Lewis offers answers to these crucial questions and shares his hope and wisdom to help heal a world hungering for a true understanding of human nature.""--Amazon.",2002,4.09,176,37569
9.78E+12,6353282,An Autobiography,Agatha Christie,"Authors, English",http://books.google.com/books/content?id=c49GQwAACAAJ&printsec=frontcover&img=1&zoom=1&source=gbs_api,Donation.,1977,4.27,560,3975
9.78E+12,6380832,Empires of the Monsoon,Richard Hall,"Africa, East",http://books.google.com/books/content?id=MuPEQgAACAAJ&printsec=frontcover&img=1&zoom=1&source=gbs_api,"Until Vasco da Gama discovered the sea-route to the East in 1497-9 almost nothing was known in the West of the exotic cultures and wealth of the Indian Ocean and its peoples. It is this civilization and its destruction at the hands of the West that Richard Hall recreates in this book. Hall's history of the exploration and exploitation by Chinese and Arab travellers, and by the Portuguese, Dutch and British alike is one of brutality, betrayal and colonial ambition.",1998,4.41,608,65
9.78E+12,6472613,Master of the Game,Sidney Sheldon,Adventure stories,http://books.google.com/books/content?id=TkTYp-Tp6_IC&printsec=frontcover&img=1&zoom=1&source=gbs_api,Kate Blackwell is an enigma and one of the most powerful women in the world. But at her ninetieth birthday celebrations there are ghosts of absent friends and absent enemies.,1982,4.11,489,43540
9.78E+12,6479677,If Tomorrow Comes,Sidney Sheldon,Adventure stories,http://books.google.com/books/content?id=l2tBi_jLuk8C&printsec=frontcover&img=1&zoom=1&source=gbs_api,"One of Sidney Sheldon's most popular and bestselling titles, repackaged and reissued for a new generation of fans.",1994,4.04,501,49170
9.78E+12,6480098,Assassin's Apprentice,Robin Hobb,American fiction,http://books.google.com/books/content?id=qTaGQgAACAAJ&printsec=frontcover&img=1&zoom=1&source=gbs_api,Fantasy-roman.,1996,4.15,460,133972
9.78E+12,6482074,Warhost of Vastmark,Janny Wurts,Fiction,http://books.google.com/books/content?id=uOL0fpS9WZkC&printsec=frontcover&img=1&zoom=1&source=gbs_api,"Tricked once more by his wily half-brother, Lysaer, Lord of Light, arrives at the tiny harbor town of Merior to find that Arithon's ship yards have been abandoned and meticulously destroyed, and that the Master of Shadow has disappeared as if into thin air. Meanwhile Arithon and the Mad Prophet Dakar are traveling on foot through the treacherous Kelhorn Mountains towards the Vastmark clans, there to raise further support for his cause. But raising a warhost is a costly business. Is it mere coincidence that Princess Talith—Lysaer's beautiful, headstrong wife—is taken captive and held for a vast ransom by a master brigand? The forces of light and shadow circle and feint, drawing ever closer to a huge conflict. And in the background the Fellowship of Seven Sorcerers and the Koriani Enchantresses watch and plan, and wait.",1995,4.03,522,2966
9.78E+12,6483011,The Once and Future King,Terence Hanbury White,Arthurian romances,http://books.google.com/books/content?id=Jx6BvgEACAAJ&printsec=frontcover&img=1&zoom=1&source=gbs_api,"An omnibus volume of the author's complete story of the Arthurian epic which includes: ""The sword in the stone"" (1939), ""The witch in the wood"" (1939), ""The ill-made knight"" (1940), ""The candle in the wind"" (published for the first time), and ""The book of Merlyn."" 1996.",1996,4.04,823,2805
9.78E+12,6483895,Murder in LaMut,Raymond E. Feist;Joel Rosenberg,Adventure stories,http://books.google.com/books/content?id=I2jbBlMHlAMC&printsec=frontcover&img=1&zoom=1&source=gbs_api,"Available in the U.S. for the first time, this is the second volume in the exceptional Legends of the Riftwar series from ""New York Times""-bestselling authors Feist and Rosenberg.",2003,3.7,337,5083
9.78E+12,6483909,Jimmy the Hand,Raymond E. Feist;S. M. Stirling,Fantasy fiction,http://books.google.com/books/content?id=hV4-oITYFN8C&printsec=frontcover&img=1&zoom=1&source=gbs_api,"Jimmy the Hand, boy thief of Krondor, lived in the shadows of the city. Though gifted beyond his peers, Jimmy is merely a pickpocket with potential--until he aids Prince Arutha in the rescue of Princess Anita from Duke Guy du Bas-Tyra, and runs afoul of ""Black Guy's"" secret police. Facing a choice between disappearing on his own or in a weighted barrel at the bottom of Krondor's harbor, Jimmy chooses the former. Forced to flee the only home he's ever known, Jimmy finds himself among the unsuspecting rural villagers of Land's End, where he hopes to prosper with his talents for con and thievery. But Land's End is home to many who tread the crooked path--and to a dark, dangerous presence even the local smugglers don't recognize. And suddenly Jimmy's youthful bravado and courage are leading him into the maw of chaos . . . and, quite possibly, to his doom.",2003,3.95,368,5579
9.78E+12,6486142,Well of Darkness,Margaret Weis;Tracy Hickman,,http://books.google.com/books/content?id=XrwaAAAACAAJ&printsec=frontcover&img=1&zoom=1&source=gbs_api,"Gareth is just a frightened young lad when he is drafted in to be the whipping-boy for the unruly Prince Dagnarus. Yet as they grow to be men, an unshakable bond is formed. And it is their destiny for them to become the two most powerful - and feared - men in the kingdom. But when Dagnarus decides to become a knight himself, he begins a chain of evil events that threaten to destroy the entire kingdom. Only by uniting the Sovereign Stone can peace be restored, and it is up to Dagnarus' brother Helmos to try to achieve this impossible task, using his father's soldiers against his brother's army. All the while, Gareth is gaining mastery over the sinister Void magic, and he is devoted to helping his childhood companion.. This gripping story of magical power and corruption takes the unique viewpoint of focusing on the evil characters, as we follow them from boys to men. Filled with action, suspense and wonderfully imaginative characters, Water From the Well of Darkness is set to elevate the careers of bestselling authors Weis & Hickman to spectacular new heights.",2001,3.66,599,68
9.78E+12,6496431,The Little House,Philippa Gregory,Country life,http://books.google.com/books/content?id=rbvUPps9vKsC&printsec=frontcover&img=1&zoom=1&source=gbs_api,"It was easy for Elizabeth. She married the man she loved. It was harder for Ruth. She married Elizabeth's son and then found that, somehow, she could never quite measure up. This thriller examines what women want and what they fear, as Ruth confronts the shifting borders of her own sanity.",1998,3.66,368,1832
9.78E+12,6496873,Mystical Paths,Susan Howatch,English fiction,http://books.google.com/books/content?id=by4ytBy63o0C&printsec=frontcover&img=1&zoom=1&source=gbs_api,1968 finds Nicholas Darrow wrestling with personal problems. How can he marry Rosalind when he is unable to avoid promiscuity? How can he become a priest when he finds it so difficult to live as one? And can he break his dangerous dependence on his father?,1996,4.23,576,1023
9.78E+12,6498868,The Mad Ship,Robin Hobb,Fantasy fiction,http://books.google.com/books/content?id=2iWezkfdBE8C&printsec=frontcover&img=1&zoom=1&source=gbs_api,"Fantasy master Robin Hobb delivers the stunning second volume of her Liveship Traders trilogy, returning to the timeless city of Bingtown, where pirates now plague the coasts and the dreaded slave trade flourishes. Althea Vestrit doesnt have time to be afraid, for her familys newly awakened Liveship, Vivacia, has been seized by the ruthless pirate Kennit. So Althea hatches a bold plan. But to carry it out, she must recruit a Liveship that has already slain two crews -- and is said to be insane.",2000,4.24,906,36101
9.78E+12,6499163,Post Captain,Patrick O'Brian,"Aubrey, Jack (Fictitious character)",http://books.google.com/books/content?id=S761k-z51Q4C&printsec=frontcover&img=1&zoom=1&source=gbs_api,"This tale begins with Jack Aubrey arriving home from his exploits in the Mediterranean to find England at peace following the Treaty of Amiens. He and his friend Stephen Maturin, surgeon and secret agent, begin to live the lives of country gentlemen, hunting, entertaining and enjoying more amorous adventures. Their comfortable existence, however, is cut short when Jack is overnight reduced to a pauper with enough debts to keep him in prison for life. He flees to the continent to seek refuge: instead he finds himself a hunted fugitive as Napoleon has ordered the internment of all Englishmen in France. Aubrey's adventures in escaping from France and the debtors' prison will grip the reader as fast as his unequalled actions at sea.",1996,4.29,474,7815
9.78E+12,6499260,The Reverse of the Medal,Patrick O'Brian,Adventure stories,http://books.google.com/books/content?id=YtjxFRb39Z4C&printsec=frontcover&img=1&zoom=1&source=gbs_api,"In this book, Jack Aubrey returns from his duties protecting whalers off the South American coast and is persuaded by a casual acquaintance to make investments in the City on the strength of supposedly certain information. From there he is led into the half-worlds of the London criminal underground and of government espionage - the province of his friend, Stephen Maturin.",1997,4.41,261,177
9.78E+12,6499627,Miss Marple,Agatha Christie,"Detective and mystery stories, English",http://books.google.com/books/content?id=a96qPwAACAAJ&printsec=frontcover&img=1&zoom=1&source=gbs_api,"Miss Marple featured in 20 short stories, published in a number of different collections in Britain and America. Presented here in their order of publication, Miss Marple uses her unique insight to deduce the truth about a series of unsolved crimes.",1997,4.2,359,6235
9.78E+12,6511481,The Years of Rice and Salt,Kim Stanley Robinson,Black Death,http://books.google.com/books/content?id=I38CFD1RnmsC&printsec=frontcover&img=1&zoom=1&source=gbs_api,"Hailed by ""The New York Times Book Review"" as ""eye-opening, "" this alternative history of the last 600 years begins as the Black Death kills nearly everyone in Europe, and China, India, and the nations of Islam now control the world.",2003,3.73,772,194
9.78E+12,6512674,Spares,Michael Marshall Smith,Human cloning,http://books.google.com/books/content?id=83RrAdP9y5UC&printsec=frontcover&img=1&zoom=1&source=gbs_api,"Spares - human clones, the ultimate health insurance. An eye for an eye - but some people are doing all the taking. The story of Jack Randall: burnt-out, dropped out, and way overdrawn at the luck bank. But as caretaker on a Spares Farm, he still has a choice, and it might make a difference.",1998,4.13,317,2481
9.78E+12,6513085,Gravity,Tess Gerritsen,Science fiction,http://books.google.com/books/content?id=KI66cH39n6sC&printsec=frontcover&img=1&zoom=1&source=gbs_api,"Emma Watson a research physician has been training for the mission of a lifetime: to study living organisms in the microgravity of space. But the true and lethal nature of the experiment has not been revealed to NASA and once aboard the space station things start to go wrong. A culture of single-celled Archaeons, gathered from the deep sea, begin to rapidly multiply and infect the crew - with deadly and agonising results. As her estranged husband and ground crew at NASA work against the clock to launch a rescue Emma stuggles to contain the lethal microbe. But with the contagion threatening Earth's population, there are those who would leave the astronauts stranded in orbit, quarantined aboard the station.",2004,4.04,342,8024
9.78E+12,6514642,The Wise Woman,Philippa Gregory,Great Britain,http://books.google.com/books/content?id=BEr9wAEACAAJ&printsec=frontcover&img=1&zoom=1&source=gbs_api,"Alone and vulnerable, Alys joins a nunnery in an attempt to escape poverty but finds herself thrown back into the outside world when Henry VIII's wreckers destroy her sanctuary. With nothing but her looks, her magic and her own instinctive cunning, Alys has to tread a perilous path between the faith of her childhood and her own female power. When she falls in love with Hugo, the feudal lord and another woman's husband, she dips into witchcraft to defeat her rival and to win her lover, only to find that magic makes a poor servant but a dominant master. Since heresy against the new church means the stake, and witchcraft the rope, Alys's danger is mortal. A woman's powers are not longer safe to use...",2002,3.31,640,6583
9.78E+12,6514855,Girls' Night in,Jessica Adams;Chris Manby;Fiona Walker,American fiction,http://books.google.com/books/content?id=xLwHHQAACAAJ&printsec=frontcover&img=1&zoom=1&source=gbs_api,"'Girls' Night In' features stories about growing up, growing out of, moving out, moving on, falling apart and getting it all together. So turn off your cell phone and curl up on the couch: this is one 'Girls' Night In' you won't want to miss.",2000,3.26,586,140
9.78E+12,6545866,The White Album,Joan Didion,American essays,http://books.google.com/books/content?id=qauOPwAACAAJ&printsec=frontcover&img=1&zoom=1&source=gbs_api,"This collection of essays recounts what took place on the long morning after the 1960s, when everyone was coming down from their particular bad trip. Didion observes the dramas that explode as America goes into collective detox: the mother abandoning her five-year-old daughter on the central reservation of Interstate 5; Huey Newton and the Black Panthers preaching from their cells; students, in unconscious parody, simulating the disaffection of the 1960s.",1993,4.17,224,91
9.78E+12,6550436,The Bonesetter's Daughter,Amy Tan,China,http://books.google.com/books/content?id=4KHT6mIMDt4C&printsec=frontcover&img=1&zoom=1&source=gbs_api,"Tells the story of three generations of Chinese women, beginning at the turn of the century.",2001,3.98,352,414
9.78E+12,6551394,The Lexus and the Olive Tree,Thomas L. Friedman,Capitalism,http://books.google.com/books/content?id=u8zxpq6o7HYC&printsec=frontcover&img=1&zoom=1&source=gbs_api,"Half of this new, post-Cold War world is intent on building a better Lexus, on streamlining their societies and economies for the global marketplace, while the other half is locked in elemental struggles over who owns which olive tree, which strip of land.",2000,3.59,352,87
9.78E+12,6551815,'Tis,Frank McCourt,Ireland,http://books.google.com/books/content?id=Q3BhQgAACAAJ&printsec=frontcover&img=1&zoom=1&source=gbs_api,"FROM THE PULIZER PRIZE-WINNING AUTHOR OF THE #1 ""NEW YORK TIMES"" BESTSELLER ""ANGELA'S ASHES"" Frank McCourt's glorious childhood memoir, ""Angela's Ashes, "" has been loved and celebrated by readers everywhere. It won the National Book Critics Circle Award, the ""Los Angeles Times"" Book Award and the Pulitzer Prize. Rarely has a book so swiftly found its place on the literary landscape. And now we have ""'Tis, "" the story of Frank's American journey from impoverished immigrant to brilliant teacher and raconteur. Frank lands in New York at age nineteen and gets a job at the Biltmore Hotel, where he immediately encounters the vivid hierarchies of this ""classless country,"" and then is drafted into the army and is sent to Germany to train dogs and type reports. It is Frank's incomparable voice that renders these experiences spellbinding. When Frank returns to America in 1953, he works on the docks, always resisting what everyone tells him. He knows that he should be getting an education, and though he left school at fourteen, he talks his way into New York University. There, he falls in love with the quintessential Yankee and tries to live his dream. But it is not until he starts to teach that Frank finds his place in the world.",2000,3.68,495,44179
9.78E+12,6754899,A Small Pinch of Weather,Joan Aiken,"Children's stories, English",http://books.google.com/books/content?id=QiFhOBpYZoYC&printsec=frontcover&img=1&zoom=1&source=gbs_api,A magical and fantastic collection of early stories by one of the most original children's authors of the 20th century. For 8-11 year olds.,2000,4.27,239,116
9.78E+12,7103670,Koko,Peter Straub,Male friendship,http://books.google.com/books/content?id=QV_XQKj4OMkC&printsec=frontcover&img=1&zoom=1&source=gbs_api,Koko is Peter Straub's foray into the psychological horror of the Vietnam War.,2001,3.56,634,7586
9.78E+12,7105045,Tree and Leaf,John Ronald Reuel Tolkien,Literary Collections,http://books.google.com/books/content?id=aPb_AAIcwZ0C&printsec=frontcover&img=1&zoom=1&source=gbs_api,"""The two works 'On fairy-stories' and 'Leaf by Niggle' were first brought together to form the book 'Tree and leaf' in 1964. In this new edition a third element is added: the poem Mythopoeia, the making of myths...""--Preface.",2001,4.09,176,2245
9.78E+12,7111509,Partners in Crime,Agatha Christie,"Beresford, Tommy (Fictitious character)",http://books.google.com/books/content?id=L0bfy0zgkegC&printsec=frontcover&img=1&zoom=1&source=gbs_api,"The Famous Volume Of Tommy & Tuppence Linked Short Stories, Reissued In A New Look To Coincide With The Brand New Series Of Tommy & Tuppence Bbc Movies. Tommy And Tuppence Beresford Were Restless For Adventure, So When They Were Asked To Take Over Blunt S International Detective Agency, They Leapt At The Chance. After Their Triumphant Recovery Of A Pink Pearl, Intriguing Cases Kept On Coming Their Way: A Stabbing On Sunningdale Golf Course; Cryptic Messages In The Personal Columns Of Newspapers; And Even A Box Of Poisoned Chocolates.",2001,3.77,347,9506
9.78E+12,7113803,Murder in Mesopotamia,Agatha Christie,Detective and mystery stories,http://books.google.com/books/content?id=oFkbc7BbYN0C&printsec=frontcover&img=1&zoom=1&source=gbs_api,"An archaeologist's wife is murdered on the shores of the River Tigris in Iraq... It was clear to Amy Leatheran that something sinister was going on at the Hassanieh dig in Iraq; something associated with the presence of 'Lovely Louise', wife of celebrated archaeologist Dr Leidner. In a few days' time Hercule Poirot was due to drop in at the excavation site. But with Louise suffering from terrifying hallucinations, and tension within the group becoming almost unbearable, Poirot might just be too late...",2001,3.89,264,25692
9.78E+12,7116268,"The Lord of the Rings, the Return of the King",Jude Fisher,Imaginary wars and battles,http://books.google.com/books/content?id=kNBnQgAACAAJ&printsec=frontcover&img=1&zoom=1&source=gbs_api,"A visual guide to the third in the Lord of the Rings movie trilogy. A large-format, full-colour guide to the characters, places, landscapes, artefacts, battles, and costumes as seen in the film, it features images, informative text and specially commissioned extras.",2003,4.59,72,22
9.78E+12,7117531,All Families are Psychotic,Douglas Coupland,Dysfunctional families,http://books.google.com/books/content?id=jYBsNp6NPVoC&printsec=frontcover&img=1&zoom=1&source=gbs_api,"On the eve of the next Space Shuttle mission, a divided family comes together... Warm, witty and wise, All Families Are Psychotic is Coupland at the very top of his form: 'Irresistibly hilarious, unique and wonderful' Independent on Sunday In a cheap motel an hour from Cape Canaveral, Janet Drummond takes her medication, and does a rapid tally of the whereabouts of her children. Wade has spent the night in jail; suicidal Bryan is due to arrive at any moment with his vowel-free girlfriend, Shw; and then there is Sarah, 'a bolt of lightning frozen in midflash' -- here in Orlando to be the star of Friday's shuttle mission. With Janet's ex-husband and his trophy wife also in town, Janet spends a moment contemplating her family, and where it all went wrong. Or did it?",2002,3.69,279,350
9.78E+12,7119356,Appointment with Death,Agatha Christie,Detective and mystery stories,http://books.google.com/books/content?id=lSYwsRkcw4YC&printsec=frontcover&img=1&zoom=1&source=gbs_api,"A repugnant Amercian widow is killed during a trip to Petra... Among the towering red cliffs of Petra, like some monstrous swollen Buddha, sat the corpse of Mrs Boynton. A tiny puncture mark on her wrist was the only sign of the fatal injection that had killed her. With only 24 hours available to solve the mystery, Hercule Poirot recalled a chance remark he'd overheard back in Jerusalem: 'You see, don't you, that she's got to be killed?' Mrs Boynton was, indeed, the most detestable woman he'd ever met...",2001,3.86,303,24859
9.78E+12,7120680,Hallowe'en Party,Agatha Christie,"Poirot, Hercule (Fictitious character)",http://books.google.com/books/content?id=Qlx98EGK_jMC&printsec=frontcover&img=1&zoom=1&source=gbs_api,"No one believes a little girl when she insists that she has witnessed a murder until she herself turns up drowned, and Hercule Poirot sets out to catch the killer.",2001,3.66,336,18820
9.78E+12,7120699,Hercule Poirot's Christmas,Agatha Christie,Christmas stories,http://books.google.com/books/content?id=EA0j4Jzn4vAC&printsec=frontcover&img=1&zoom=1&source=gbs_api,"On the night before Christmas, cruel, tyrannical, filthy-rich Simeon Lee is found in his locked bedroom with his throat cut. Now Hercule Poirot must put his deductive powers to the test to solve one of his most chilling cases--and to prevent a clever killer from spilling more blood.",2001,3.93,335,23113
