isbn13 ,isbn10,title,authors,categories,thumbnail,description,published_year,average_rating,numbers,ratings_count
9.78E+12,64405958,Seven Spiders Spinning,Gregory Maguire,Juvenile Fiction,http://books.google.com/books/content?id=VPf_uAEACAAJ&printsec=frontcover&img=1&zoom=1&source=gbs_api,"When seven Siberian snow spiders, frozen during the Ice Age, defrost and escape en route to Harvard for analysis, they wreak havoc on a small New England town, disrupting the school Halloween pageant with hilarious results. An ALA Notable Children's Book. Reissue.",1995,3.61,144,259
9.78E+12,64406032,American Dragons,Laurence Yep,Juvenile Fiction,http://books.google.com/books/content?id=-NZzW8s9EMwC&printsec=frontcover&img=1&zoom=1&source=gbs_api,"Includes short stories, poems, and excerpts from plays that relate what it is like growing up Asian American.",1995,3.41,256,63
9.78E+12,64407144,Down to the Bonny Glen,Melissa Wiley,Juvenile Fiction,http://books.google.com/books/content?id=nO5OGr8anJ8C&printsec=frontcover&img=1&zoom=1&source=gbs_api,"With the arrival of her new governess, Miss Crow, Martha begins to see that her work is quite important and soon realizes she could learn a great deal from her if she only took the time to get to know her. Simultaneous.",2001,4.14,321,1438
9.78E+12,64407314,Monster,Walter Dean Myers,Juvenile Fiction,http://books.google.com/books/content?id=se3BugEACAAJ&printsec=frontcover&img=1&zoom=1&source=gbs_api,"FADE IN: INTERIOR: Early morning in CELL BLOCK D, MANHATTAN DETENTION CENTER. Steve (Voice-Over) Sometimes I feel like I have walked into the middle of a movie. Maybe I can make my own movie. The film will be the story of my life. No, not my life, but of this experience. I'll call it what the lady prosecutor called me ... Monster.",2001,3.71,281,53833
9.78E+12,64408582,Emily of Deep Valley,Maud Hart Lovelace,Juvenile Fiction,http://books.google.com/books/content?id=8uT9_Io3bYwC&printsec=frontcover&img=1&zoom=1&source=gbs_api,"After graduating high school, Emily Webster longs to go off to university with everyone else, but she must stay at home and take care of her grandfather, a Civil War veteran, and it is at home that she discovers many new adventures. Reprint.",2000,4.23,304,2637
9.78E+12,64408671,The Trumpet of the Swan,E. B. White,Juvenile Fiction,http://books.google.com/books/content?id=2lybT5x8FCsC&printsec=frontcover&img=1&zoom=1&source=gbs_api,"Swan Song Like the rest of his family, Louis is a trumpeter swan. But unlike his four brothers and sisters, Louis can't trumpet joyfully. In fact, he can't even make a sound. And since he can't trumpet his love, the beautiful swan Serena pays absolutely no attention to him. Louis tries everything he can think of to win Serena's affection -- he even goes to school to learn to read and write. But nothing seems to work. Then his father steals him a real brass trumpet. Is a musical instrument the key to winning Louis his love?",2000,4.07,252,61304
9.78E+12,64408744,The Good Liar,Gregory Maguire,Juvenile Fiction,http://books.google.com/books/content?id=NLBPD7kd5YQC&printsec=frontcover&img=1&zoom=1&source=gbs_api,"Now an old man living in the United States, Marcel recalls his childhood in German-occupied France, especially the summer that he and his older brother RenT befriended a young German soldier. Reprint.",2002,3.53,144,122
9.78E+12,64409902,Old Town in the Green Groves,Cynthia Rylant;Jim LaMarche,Juvenile Fiction,http://books.google.com/books/content?id=YUQMAXdqvhgC&printsec=frontcover&img=1&zoom=1&source=gbs_api,"After grasshoppers ruin the crops, eight-year-old Laura Ingalls and her family leave Plum Creek and move to Burr Oak, Iowa, where they experience life in a small town and help manage a hotel. Reprint.",2004,4.04,176,4631
9.78E+12,64410722,Four Stupid Cupids,Gregory Maguire,Juvenile Fiction,http://books.google.com/books/content?id=471OUKKACq8C&printsec=frontcover&img=1&zoom=1&source=gbs_api,The students' scheme to find a love match for their beloved teacher on Valentine's Day turns into a comedy of errors when four stupid cupids from Ancient Greece try to help.,2001,3.52,224,110
9.78E+12,64410935,Charlotte's Web (full color),E. B. White,Juvenile Fiction,http://books.google.com/books/content?id=pylJbfNIwoIC&printsec=frontcover&img=1&zoom=1&source=gbs_api,"Beloved by generations, Charlotte's Web and Stuart Little are two of the most cherished stories of all time. Now, for the first time ever, these treasured classics are available in lavish new collectors' editions. In addition to a larger trim size, the original black-and-white art by Garth Williams has been lovingly colorized by renowned illustrator Rosemary Wells, adding another dimension to these two perfect books for young and old alike.",2001,4.16,184,1229902
9.78E+12,64420809,Little House Friends,Heather Henson;Laura Ingalls Wilder,Juvenile Fiction,http://books.google.com/books/content?id=gMZbAAfZwAIC&printsec=frontcover&img=1&zoom=1&source=gbs_api,Laura Ingalls shares adventures and good times with her friends while growing up on the western frontier.,1998,3.99,80,70
9.78E+12,64420817,Christmas Stories,Laura Ingalls Wilder,Juvenile Fiction,http://books.google.com/books/content?id=qJxFQDe9AP4C&printsec=frontcover&img=1&zoom=1&source=gbs_api,"Gentle adaptations of Laura Ingalls Wilder's celebrated Little House stories have been gathered together here in two new titles in our Little House Chapter Book series. In Christmas Stories, join Laura and her family for some pioneer Christmas celebrations. Christmas on the frontier means visits from friends, good things to eat, and presents! For Laura, every Christmas in the little house is better than the one before. Laura and her friends share wonderful adventures in Little House Friends. From racing ponies with cousin Lena to bobsled rides with Cap Garland and the gang, Laura loves spending time with her friends. Even mean old Nellie Oleson can't spoil Laura's fun!With simple text, entertaining stories, and Renee Graef's beautiful black-and-white artwork, Little House Chapter Books are the perfect way to introduce beginning chapter-book readers to the world of Little House.",1998,4.22,80,63
9.78E+12,64433730,Winter Days in the Big Woods,Laura Ingalls Wilder,Juvenile Fiction,http://books.google.com/books/content?id=H-igY69LTxcC&printsec=frontcover&img=1&zoom=1&source=gbs_api,"Laura helps Ma and Pa make the little log cabin snug and cozy for the snowy days ahead. 1994 ""Pick of the Lists"" (ABA)",1995,4.28,32,1487
9.78E+12,64434877,Christmas in the Big Woods,Laura Ingalls Wilder,Juvenile Fiction,http://books.google.com/books/content?id=FT1YpUwRYykC&printsec=frontcover&img=1&zoom=1&source=gbs_api,"Long ago, a little girl named Laura Ingalls lived in a little house in the Big Woods of Wisconsin with her Pa, her Ma, her sisters, Mary and Carrie, and their good old bulldog, Jack. Winter was just around the corner, and Laura worked hard to help make the little house ready for the cold days ahead. Soon there was frost on the windows and snow on the ground, but Laura and her folks were warm and cozy in their snug little house in the Big Woods. Laura Ingalls Wilder's Little House books have been cherished by generations of readers. Now for the first time, the youngest readers can share her adventures in these very special picture books adapted from Laura Ingalls Wilder's beloved storybooks. Renée Graef's warm paintings, inspired by Garth Williams' classic Little House illustrations, bring Laura and her family lovingly to life.",1997,4.19,32,2062
9.78E+12,64434982,The Deer in the Wood,Laura Ingalls Wilder,Juvenile Fiction,http://books.google.com/books/content?id=V7YDWiHI7m4C&printsec=frontcover&img=1&zoom=1&source=gbs_api,"Even the youngest child can enjoy a special adaptation of a classic Little House tale, as Laura and Mary listen to Pa talk about meeting a mother deer and her baby fawn deep in the Big Woods of Wisconsin.",1999,4.17,32,302
9.78E+12,64435261,A Little Prairie House,Laura Ingalls Wilder,Juvenile Fiction,http://books.google.com/books/content?id=pRSju95iidoC&printsec=frontcover&img=1&zoom=1&source=gbs_api,"Long, long ago, a little girl named Laura Ingalls headed west toward the prairie with her Pa, her Ma, her sisters, Mary and Carrie, and their good old bulldog, Jack. They traveled far each day in their covered wagon, driving through tall grass until they found just the right spot for their new home. With the help of their kind neighbor, Mr. Edwards, Pa built a snug little house for the family in the middle of the wide-open prairie. Laura Ingalls Wilder's Little House books have been cherished by generations of readers. Now for the first time, the youngest readers can share her adventure in these very special picture books adapted from Laura Ingalls Wilder's beloved story-books. Renee Graef's warm paintings, inspired by Garth Williams' classic Little House illustrations, bring Laura and her family lovingly to life. Renée Graef recieved her bachelor's degree in art from the University of Wisconsin at Madison. She is the illustrator of teh paper dolls and the Kirsten books in the American Girls Collection. She is also an avid hat collector, with over 150 hats at last count. She lives in Milwaukee, Wisconsin, with her huisband, Tim, and thier children, Maggie and Maxfeild.Join the Ingalls family as they pick a special spot on the prairie and build their snug log cabin home. Their new neighbor, Mr. Edwards, comes by to help, and after the hard work is through, everyone sings and dances to the joyful music of Pa's fiddle. Renee Graef's enchanting full-color illustrations, inspired by Garth William's classic artwork, bring Laura and her family lovingly to life in this eleventh title in the My First Little House Books series, adapted from Laura Ingalls Wilder's beloved storybooks.",1999,4.19,32,1533
9.78E+12,64440575,Grizzwold,Syd Hoff,Juvenile Fiction,http://books.google.com/books/content?id=Sy_X4g1pvzcC&printsec=frontcover&img=1&zoom=1&source=gbs_api,"Grizzwold the lovable bear is having a tough time finding somewhere to live. He's too big for most places, and too clumsy for others. He's not even any good as a live bearskin rug! Will Grizzwold ever find a home that's just right?",1984,3.8,64,206
9.78E+12,64440958,Chester,Syd Hoff,Juvenile Fiction,http://books.google.com/books/content?id=DiGFBC7APpYC&printsec=frontcover&img=1&zoom=1&source=gbs_api,"Chester, a wild horse who wants to be tame, comes to the city looking for a home. ‘Reading for fun: the artist’s sense of pacing makes this book race along.’ —Saturday Review.",1986,3.75,64,187
9.78E+12,64441768,Captain Cat,Syd Hoff,Juvenile Fiction,http://books.google.com/books/content?id=sHz4sQ3mmjwC&printsec=frontcover&img=1&zoom=1&source=gbs_api,"A patriotic feline, Captain Cat springs out of bed whenever the bugle sounds and he has more stripes than any of the soldiers. But most of all, this young recruit and his best friend Pete know what it really takes to make the army a home—friendship. ‘Hoff continues his string of hits.’ —BL. ‘Hoff has maintained his deft touch with a title that’s sure to appeal to youngsters.’ —SLJ.",1994,3.66,48,107
9.78E+12,64462048,My Little House Crafts Book,Carolyn Strom Collins,Juvenile Nonfiction,http://books.google.com/books/content?id=lTzrsOMvcNcC&printsec=frontcover&img=1&zoom=1&source=gbs_api,"Make the same pioneer crafts that Laura did! In her beloved Little House books, Laura Ingalls Wilder tells of her pioneer childhood growing up on the frontier. Because the Ingallses often lived far away from any stores, and because they had little money, Laura and her family had to make most of their own household items, using whatever materials were available. Now, with MY LITTLE HOUSE CRAFTS BOOK, you can share a part of Laura's pioneer days by learning how to make the same things that she and her family made for their little homes on the frontier. Inside this book are easy, step-by-step instructions for 18 crafts taken straight from the pages of Laura's Little House books. All you need to get started are a few simple supplies, and you're on your way to making fun and useful pioneer crafts that you'll cherish forever.",1998,4.05,64,56
9.78E+12,64471969,Shade's Children (rack),Garth Nix,Juvenile Fiction,http://books.google.com/books/content?id=_jlglwEACAAJ&printsec=frontcover&img=1&zoom=1&source=gbs_api,"The Key to Survival Rests in the Hands of Shade's Children In a futuristic urban wasteland, evil Overlords have decreed that no child shall live a day past his fourteenth birthday. On that Sad Birthday, the child is the object of an obscene harvest resulting in the construction of a machinelike creature whose sole purpose is to kill. The mysterious Shade -- once a man, but now more like the machines he fights -- recruits the few children fortunate enough to escape. With luck, cunning, and skill, four of Shade's children come closer than any to discovering the source of the Overlords' power -- and the key to their downfall. But the closer the children get, the more ruthless Shade seems to become ...",1998,3.9,345,10368
9.78E+12,64472779,All-American Girl,Meg Cabot,Juvenile Fiction,http://books.google.com/books/content?id=Fktx5yUMHpMC&printsec=frontcover&img=1&zoom=1&source=gbs_api,"Top Ten Reasons Samantha Madison is in Deep Trouble 10. Her big sister is the most popular girl in school 9. Her little sister is a certified genius 8. She's in love with her big sister's boyfriend 7. She got caught selling celebrity portraits in school 6. And now she's being forced to take art classes 5. She's just saved the president of the United Statesfrom an assassination attempt 4. So the whole world thinks she is a hero 3. Even though Sam knows she is far, far from being a hero 2. And now she's been appointed teen ambassador to the UNAnd the number-one reason Sam's life is over?1. The president's son just might be in love with her",2003,3.74,398,58422
9.78E+12,64473554,Hexwood,Diana Wynne Jones,Young Adult Fiction,http://books.google.com/books/content?id=vDTJwAEACAAJ&printsec=frontcover&img=1&zoom=1&source=gbs_api,"Strange things happen at Hexwood Farm. From her window, Ann Stavely watches person after person disappear through the farm's gate -- and never come out again. Later, in the woods nearby, she meets a tormented sorcerer, who seems to have arisen from a centuries-long sleep. But Ann knows she saw him enter the farm just that morning. Meanwhile, time keeps shifting in the woods, where a small boy -- or perhaps a teenager -- has encountered a robot and a dragon. Long before the end of their adventure, the strangeness of Hexwood has spread from Earth right out to the center of the galaxy.",2002,3.99,464,3419
9.78E+12,66236177,A Light in the Attic Book and CD,Shel Silverstein,Juvenile Nonfiction,http://books.google.com/books/content?id=FJfQsgEACAAJ&printsec=frontcover&img=1&zoom=1&source=gbs_api,"Last night while I lay thinking here Some Whatifs crawled inside my ear And pranced and partied all night long And sang their same old Whatif song: Whatif I flunk that test? Whatif green hair grows on my chest? Whatif nobody likes me? Whatif a bolt of lightning strikes me?... To celebrate its 20th anniversary, Shel Silverstein's A Light in the Attic is now available in a special edition containing the classic hardcover book and a CD of highlights from his Grammy Award-winning album. Here in the attic of Shel Silverstein you will find Backward Bill, Sour Face Ann, the Meehoo with an Exactlywatt, and the Polar Bear in the Frigidaire. You will talk with Broiled Face, and find out what happens when Somebody steals your knees, you get caught by the Quick-Digesting Gink, a Mountain snores, and They Put a Brassiere on the Camel. From the creator of the beloved poetry collections Where the Sidewalk Ends and Falling Up, here is another wondrous book of poems and drawings.",2001,4.34,176,590
9.78E+12,66238501,The Chronicles of Narnia (adult),C. S. Lewis,Fiction,http://books.google.com/books/content?id=3VGkK_F9thYC&printsec=frontcover&img=1&zoom=1&source=gbs_api,"Journeys to the end of the world, fantastic creatures, and epic battles between good and evil -- what more could any reader ask for in one book? The book that has it all is The Lion, the Witch and the Wardrobe, written in 1949 by Clive Staples Lewis. But Lewis did not stop there. Six more books followed, and together they became known as The Chronicles of Narnia. For the past fifty years, The Chronicles of Narnia have transcended the fantasy genre to become part of the canon of classic literature. Each of the seven books is a masterpiece, drawing the reader into a land where magic meets reality, and the result is a fictional world whose scope has fascinated generations. This edition presents all seven books -- unabridged -- in one impressive volume. The books are presented here according to Lewis' preferred order, each chapter graced with an illustration by the original artist, Pauline Baynes. Deceptively simple and direct, The Chronicles of Narnia continue to captivate fans with adventures, characters, and truths that speak to readers of all ages, even fifty years after they were first published.",2001,4.26,767,425445
9.78E+12,66620104,What Would Machiavelli Do?,Stanley Bing,Humor,http://books.google.com/books/content?id=W9jVlwEACAAJ&printsec=frontcover&img=1&zoom=1&source=gbs_api,"What Would Machiavelli Do? He would feast on other people's discord He wouldn't exactly seek the company of ass-kissers and bimbos, but he wouldn't reject them out of hand either He would realize that loving yourself means never having to say you're sorry He would kill people, but only if he could feel good about himself afterward He would establish and maintain a psychotic level of control He would use other people's opinions to sell his book!",2002,3.46,176,434
9.78E+12,70488207,Virgin,James Patterson,Fiction,http://books.google.com/books/content?id=3EDbEHca_k8C&printsec=frontcover&img=1&zoom=1&edge=curl&source=gbs_api,The Blessed Virgin's deliverance of a prophecy to a peasant girl in Fatima in 1914 is followed years later by signs and omens including worldwide droughts and famines that signify its imminent fulfillment,1980,3.86,210,300
9.78E+12,71348271,Mission Possible,Ken Blanchard;Terry Waghorn,Business & Economics,http://books.google.com/books/content?id=ofjQmAJBiiwC&printsec=frontcover&img=1&zoom=1&source=gbs_api,Explains how to improve one's existing organization while creating a replacement design for the future and why change is necessary to ensure the future of one's business,1999,3.42,242,0
9.78E+12,71401946,Crucial Conversations,Kerry Patterson;Joseph Grenny;Ron McMillan;Al Switzler,Business & Economics,http://books.google.com/books/content?id=PibJN5XVQRkC&printsec=frontcover&img=1&zoom=1&source=gbs_api,"The New York Times Bestseller! Learn how to keep your cool and get the results you want when emotions flare. When stakes are high, opinions vary, and emotions run strong, you have three choices: Avoid a crucial conversation and suffer the consequences; handle the conversation badly and suffer the consequences; or read Crucial Conversations and discover how to communicate best when it matters most. Crucial Conversations gives you the tools you need to step up to life's most difficult and important conversations, say what's on your mind, and achieve the positive resolutions you want. You'll learn how to: Prepare for high-impact situations with a six-minute mastery technique Make it safe to talk about almost anything Be persuasive, not abrasive Keep listening when others blow up or clam up Turn crucial conversations into the action and results you want Whether they take place at work or at home, with your neighbors or your spouse, crucial conversations can have a profound impact on your career, your happiness, and your future. With the skills you learn in this book, you'll never have to worry about the outcome of a crucial conversation again.",2002,4.01,240,36535
9.78E+12,71428488,"Easy French Reader, Second Edition",R. de Roussy de Sales,Foreign Language Study,http://books.google.com/books/content?id=TY4AAAAACAAJ&printsec=frontcover&img=1&zoom=1&source=gbs_api,"The fun and easy way to quickly enhance your French reading skills Easy French Reader is based on the premise that the best way to learn a language is to start reading it, immediately. Suitable for raw beginners to intermediate-level language learners, this popular title features engaging readings of progressive difficulty that allow you to rapidly build your comprehension. Find out what unfamiliar words and phrases mean with the book's helpful glossary Discover the nuances of French language and culture as well as the country's history through engaging texts Get a feel for authentic French society with readings from contemporary literature",2003,3.84,228,292
9.78E+12,71433716,Slim to None,Jennifer Hendricks,Biography & Autobiography,http://books.google.com/books/content?id=fY-lfz3EujEC&printsec=frontcover&img=1&zoom=1&source=gbs_api,"""A young woman's fatal battle with anorexia, in her own words In the tradition of Go Ask Alice, Prozac Nation, and Girl Interrupted, Slim to None grants readers precious access to the emotional and psychological underpinnings of its author. Step-by-step, readers follow Jenny's long journey through a ""wasteland"" of failed treatments and therapies, false hope, and abuse by the mental health system that kept her captive most of her life. Although this disease has been at the forefront of public awareness for years, anorexia continues to claim more victims than any other mental illness. Slim to None reveals the glaring inadequacy of the mental health system to treat and fully understand this disease. The first journal of an anorexic to be published posthumously, the book discloses the innermost thoughts, fears, and hopes of a young girl stricken and fighting to recover. Jenny Hendricks painstakingly recorded her experiences as she suffered from and eventually succumbed to this eating disorder. With candor, she recounts being shipped from one doctor to another and subjected to widely varying treatments--all of which ultimately proved unsuccessful. Her father, Gordon Hendricks, fills in this compelling narrative with his own memories of his daughter's struggle.""--Publisher's description.",2004,3.65,384,574
9.78E+12,71451382,Practice Makes Perfect: Italian Verb Tenses,Paola Nanni-Tate,Foreign Language Study,http://books.google.com/books/content?id=Mbix2qU7bwcC&printsec=frontcover&img=1&zoom=1&source=gbs_api,"Practice makes perfect Italian verb tenses goes beyond other verb books to coach you in when and why verb tenses are used. In addition to an array of fully conjugated verbs, you will find clear and concise explanations that pinpoint why specific tenses work in given situations as well as plenty of engaging examples and numerous skill-building exercises. This is the ideal reference/workbook for beginning to intermediate Italian language learners whose goal is to learn to speak and write Italian with fluency.",2005,4,252,9
9.78E+12,71608915,"Goodman & Gilman's The Pharmacological Basis of Therapeutics, Eleventh Edition",Laurence Brunton;John Lazo;Keith Parker,Medical,http://books.google.com/books/content?id=PtWdBgnQdjMC&printsec=frontcover&img=1&zoom=1&source=gbs_api,"The undisputed leader in medical pharmacology, without equal. Updated to reflect all critical new developments in drug action and drug-disease interaction. This is the “desert island” book of all medical pharmacology—if you can own just one pharmacology book, this is it.",2005,,,
,,,,,,,,,,
9.78E+12,72920963,The Last Dance,Lynne Ann DeSpelder;Albert Lee Strickland,Social Science,http://books.google.com/books/content?id=CAlHAAAAMAAJ&printsec=frontcover&img=1&zoom=1&source=gbs_api,"The best-selling textbook in the field, The Last Dance offers an interdisciplinary introduction to death, dying, and bereavement. Integrating the experiential and the scholarly, as well as the emotional and intellectual dimensions of death and dying, the seventh edition has been thoroughly revised to provide the most cutting-edge coverage of death studies.",2005,3.77,664,112
,,,,,,,,,,
9.78E+12,75536390,The Complete Works,Tacitus,History,http://books.google.com/books/content?id=0U8CAAAACAAJ&printsec=frontcover&img=1&zoom=1&source=gbs_api,"Translated by Alfred John Church and William Jackson Brodribb, Edited, with an Introduction, Moses Hadas",1964,4.29,773,267
9.78E+12,91520800,My Sweet-orange Tree,José Mauro de Vasconcelos,Juvenile Nonfiction,http://books.google.com/books/content?id=A8_uAAAAMAAJ&printsec=frontcover&img=1&zoom=1&source=gbs_api,,1983,4.39,166,49
